No.	Title	Link	Authors	Keywords
202	Optimism in Reinforcement Learning with Generalized Linear Function Approximation	https://openreview.net/forum?id=CBmJwzneppz	Yining Wang, Ruosong Wang, Simon Shaolei Du, Akshay Krishnamurthy	reinforcement learning, optimism, exploration, function approximation, theory, regret analysis, provable sample efficiency
203	Graph Traversal with Tensor Functionals: A Meta-Algorithm for Scalable Learning	https://openreview.net/forum?id=6DOZ8XNNfGN	Elan Sopher Markowitz, Keshav Balasubramanian, Mehrnoosh Mirtaheri, Sami Abu-El-Haija, Bryan Perozzi, Greg Ver Steeg, Aram Galstyan	Graph, Learning, Algorithm, Scale, Message Passing, Node Embeddings
204	Diverse Video Generation using a Gaussian Process Trigger	https://openreview.net/forum?id=Qm7R_SdqTpT	Gaurav Shrivastava, Abhinav Shrivastava	video synthesis, future frame generation, video generation, gaussian process priors, diverse video generation
205	Signatory: differentiable computations of the signature and logsignature transforms, on both CPU and GPU	https://openreview.net/forum?id=lqU2cs3Zca	Patrick Kidger, Terry Lyons	signature, logsignature, gpu, library, open source
206	MoPro: Webly Supervised Learning with Momentum Prototypes	https://openreview.net/forum?id=0-EYBhgw80y	Junnan Li, Caiming Xiong, Steven Hoi	webly-supervised learning, weakly-supervised learning, contrastive learning, representation learning
207	A Universal Representation Transformer Layer for Few-Shot Image Classification	https://openreview.net/forum?id=04cII6MumYV	Lu Liu, William L. Hamilton, Guodong Long, Jing Jiang, Hugo Larochelle	
208	Primal Wasserstein Imitation Learning	https://openreview.net/forum?id=TtYSU29zgR	Robert Dadashi, Leonard Hussenot, Matthieu Geist, Olivier Pietquin	Reinforcement Learning, Inverse Reinforcement Learning, Imitation Learning, Optimal Transport, Wasserstein distance
209	Learning perturbation sets for robust machine learning	https://openreview.net/forum?id=MIDckA56aD	Eric Wong, J Zico Kolter	adversarial examples, perturbation sets, robust machine learning, conditional variational autoencoder
210	CopulaGNN: Towards Integrating Representational and Correlational Roles of Graphs in Graph Neural Networks	https://openreview.net/forum?id=XI-OJ5yyse	Jiaqi Ma, Bo Chang, Xuefei Zhang, Qiaozhu Mei	Graph Neural Network, Gaussian Copula, Gaussian Graphical Model
211	On the Critical Role of Conventions in Adaptive Human-AI Collaboration	https://openreview.net/forum?id=8Ln-Bq0mZcy	Andy Shih, Arjun Sawhney, Jovana Kondic, Stefano Ermon, Dorsa Sadigh	Multi-agent games, emergent behavior, transfer learning, human-AI collaboration
212	On the Bottleneck of Graph Neural Networks and its Practical Implications	https://openreview.net/forum?id=i80OPhOCVH2	Uri Alon, Eran Yahav	graphs, GNNs, limitations, understanding, bottleneck, over-squashing
213	The geometry of integration in text classification RNNs	https://openreview.net/forum?id=42kiJ7n_8xO	Kyle Aitken, Vinay Venkatesh Ramasesh, Ankush Garg, Yuan Cao, David Sussillo, Niru Maheswaranathan	Recurrent neural networks, dynamical systems, interpretability, document classification, reverse engineering
214	Gradient Descent on Neural Networks Typically Occurs at the Edge of Stability	https://openreview.net/forum?id=jh-rTtvkGeM	Jeremy Cohen, Simran Kaur, Yuanzhi Li, J Zico Kolter, Ameet Talwalkar	optimization, trajectory, stability, sharpness, implicit bias, implicit regularization, L-smoothness, deep learning theory, science of deep learning
215	CausalWorld: A Robotic Manipulation Benchmark for Causal Structure and Transfer Learning	https://openreview.net/forum?id=SK7A5pdrgov	Ossama Ahmed, Frederik Träuble, Anirudh Goyal, Alexander Neitz, Manuel Wuthrich, Yoshua Bengio, Bernhard Schölkopf, Stefan Bauer	reinforcement learning, transfer learning, sim2real transfer, domain adaptation, causality, generalization, robotics
216	Empirical or Invariant Risk Minimization? A Sample Complexity Perspective	https://openreview.net/forum?id=jrA5GAccy_	Kartik Ahuja, Jun Wang, Amit Dhurandhar, Karthikeyan Shanmugam, Kush R. Varshney	invariant risk minimization, IRM
217	Scaling Symbolic Methods using Gradients for Neural Model Explanation	https://openreview.net/forum?id=V5j-jdoDDP	Subham Sekhar Sahoo, Subhashini Venugopalan, Li Li, Rishabh Singh, Patrick Riley	Neural Model Explanation, SMT Solvers, Symbolic Methods
218	Control-Aware Representations for Model-based Reinforcement Learning	https://openreview.net/forum?id=dgd4EJqsbW5	Brandon Cui, Yinlam Chow, Mohammad Ghavamzadeh	
219	C-Learning: Learning to Achieve Goals via Recursive Classification	https://openreview.net/forum?id=tc5qisoB-C	Benjamin Eysenbach, Ruslan Salakhutdinov, Sergey Levine	reinforcement learning, goal reaching, density estimation, Q-learning, hindsight relabeling
220	The Deep Bootstrap Framework: Good Online Learners are Good Offline Generalizers	https://openreview.net/forum?id=guetrIHLFGI	Preetum Nakkiran, Behnam Neyshabur, Hanie Sedghi	generalization, optimization, online learning, understanding deep learning, empirical investigation
221	Improving VAEs' Robustness to Adversarial Attack	https://openreview.net/forum?id=-Hs_otp2RB	Matthew JF Willetts, Alexander Camuto, Tom Rainforth, S Roberts, Christopher C Holmes	deep generative models, variational autoencoders, robustness, adversarial attack
222	What Can You Learn From Your Muscles? Learning Visual Representation from Human Interactions	https://openreview.net/forum?id=Qm8UNVCFdh	Kiana Ehsani, Daniel Gordon, Thomas Hai Dang Nguyen, Roozbeh Mottaghi, Ali Farhadi	representation learning, computer vision
223	EEC: Learning to Encode and Regenerate Images for Continual Learning	https://openreview.net/forum?id=lWaz5a9lcFU	Ali Ayub, Alan Wagner	Continual Learning, Catastrophic Forgetting, Cognitively-inspired Learning
224	Impact of Representation Learning in Linear Bandits	https://openreview.net/forum?id=edJ_HipawCa	Jiaqi Yang, Wei Hu, Jason D. Lee, Simon Shaolei Du	linear bandits, representation learning, multi-task learning
225	MODALS: Modality-agnostic Automated Data Augmentation in the Latent Space	https://openreview.net/forum?id=XjYgR6gbCEc	Tsz-Him Cheung, Dit-Yan Yeung	deep learning, data augmentation, automated data augmentation, latent space
226	The Recurrent Neural Tangent Kernel	https://openreview.net/forum?id=3T9iFICe0Y9	Sina Alemohammad, Zichao Wang, Randall Balestriero, Richard Baraniuk	Neural Tangent Kernel, Recurrent Neural Network, Gaussian Process, Overparameterization
227	Projected Latent Markov Chain Monte Carlo: Conditional Sampling of Normalizing Flows	https://openreview.net/forum?id=MBpHUFrcG2x	Chris Cannella, Mohammadreza Soltani, Vahid Tarokh	Conditional Sampling, Normalizing Flows, Markov Chain Monte Carlo, Missing Data Inference
228	Learning the Pareto Front with Hypernetworks	https://openreview.net/forum?id=NjF772F4ZZR	Aviv Navon, Aviv Shamsian, Ethan Fetaya, Gal Chechik	Multi-objective optimization, multi-task learning
229	Estimating and Evaluating Regression Predictive Uncertainty in Deep Object Detectors	https://openreview.net/forum?id=YLewtnvKgR7	Ali Harakeh, Steven L. Waslander	Object Detection, Predictive Uncertainty Estimation, Proper Scoring Rules, Variance Networks, Energy Score, Computer Vision
230	Predicting Classification Accuracy When Adding New Unobserved Classes	https://openreview.net/forum?id=Y9McSeEaqUh	Yuli Slavutsky, Yuval Benjamini	multiclass classification, classification, extrapolation, accuracy, ROC
231	BRECQ: Pushing the Limit of Post-Training Quantization by Block Reconstruction	https://openreview.net/forum?id=POWv6hDd9XH	Yuhang Li, Ruihao Gong, Xu Tan, Yang Yang, Peng Hu, Qi Zhang, Fengwei Yu, Wei Wang, Shi Gu	Post Training Quantization, Mixed Precision, Second-order analysis
232	No MCMC for me: Amortized sampling for fast and stable training of energy-based models	https://openreview.net/forum?id=ixpSxO9flk3	Will Sussman Grathwohl, Jacob Jin Kelly, Milad Hashemi, Mohammad Norouzi, Kevin Swersky, David Duvenaud	Generative Models, EBM, Energy-Based Models, Energy Based Models, semi-supervised learning, JEM
233	GraphCodeBERT: Pre-training Code Representations with Data Flow	https://openreview.net/forum?id=jLoC4ez43PZ	Daya Guo, Shuo Ren, Shuai Lu, Zhangyin Feng, Duyu Tang, Shujie LIU, Long Zhou, Nan Duan, Alexey Svyatkovskiy, Shengyu Fu, Michele Tufano, Shao Kun Deng, Colin Clement, Dawn Drain, Neel Sundaresan, Jian Yin, Daxin Jiang, Ming Zhou	Pre-training, BERT, Code Representations, Code Structure, Data Flow
234	Conservative Safety Critics for Exploration	https://openreview.net/forum?id=iaO86DUuKi	Homanga Bharadhwaj, Aviral Kumar, Nicholas Rhinehart, Sergey Levine, Florian Shkurti, Animesh Garg	Safe exploration, Reinforcement Learning
235	Improve Object Detection with Feature-based Knowledge Distillation: Towards Accurate and Efficient Detectors	https://openreview.net/forum?id=uKhGRvM8QNH	Linfeng Zhang, Kaisheng Ma	Knowledge Distillation, Object Detection, Teacher-Student Learning, Non-Local Modules, Attention Modules
236	A Temporal Kernel Approach for Deep Learning with Continuous-time Information	https://openreview.net/forum?id=whE31dn74cL	Da Xu, Chuanwei Ruan, Evren Korpeoglu, Sushant Kumar, Kannan Achan	Kernel Learning, Continuous-time System, Spectral Distribution, Random Feature, Reparameterization, Learning Theory
237	For self-supervised learning, Rationality implies generalization, provably	https://openreview.net/forum?id=Srmggo3b3X6	Yamini Bansal, Gal Kaplun, Boaz Barak	Deep Learning Theory, Generalization Bounds, Self-supervised learning, Representation learning
238	How to Find Your Friendly Neighborhood: Graph Attention Design with Self-Supervision	https://openreview.net/forum?id=Wi5KUNlqWty	Dongkwan Kim, Alice Oh	Graph Neural Network, Attention Mechanism, Self-supervised Learning
239	Interpretable Models for Granger Causality Using Self-explaining Neural Networks	https://openreview.net/forum?id=DEa4JdMWRHp	Ričards Marcinkevičs, Julia E Vogt	time series, Granger causality, interpretability, inference, neural networks
240	Meta-learning Symmetries by Reparameterization	https://openreview.net/forum?id=-QxT4mJdijq	Allan Zhou, Tom Knowles, Chelsea Finn	meta-learning, equivariance, convolution, symmetry
241	Removing Undesirable Feature Contributions Using Out-of-Distribution Data	https://openreview.net/forum?id=eIHYL6fpbkA	Saehyung Lee, Changhwa Park, Hyungyu Lee, Jihun Yi, Jonghyun Lee, Sungroh Yoon	adversarial training, adversarial robustness, generalization, out-of-distribution
242	Mind the Gap when Conditioning Amortised Inference in Sequential Latent-Variable Models	https://openreview.net/forum?id=a2gqxKDvYys	Justin Bayer, Maximilian Soelch, Atanas Mirchev, Baris Kayalibay, Patrick van der Smagt	variational inference, state-space models, amortized inference, recurrent networks
243	On the Universality of the Double Descent Peak in Ridgeless Regression	https://openreview.net/forum?id=0IO5VdnSAaH	David Holzmüller	Double Descent, Interpolation Peak, Linear Regression, Random Features, Random Weights Neural Networks
244	Fair Mixup: Fairness via Interpolation	https://openreview.net/forum?id=DNl5s5BXeBn	Ching-Yao Chuang, Youssef Mroueh	fairness, data augmentation
245	Self-supervised Learning from a Multi-view Perspective	https://openreview.net/forum?id=-bdp_8Itjwp	Yao-Hung Hubert Tsai, Yue Wu, Ruslan Salakhutdinov, Louis-Philippe Morency	Self-supervised Learning, Unsupervised Learning, Multi-view Representation Learning
246	Integrating Categorical Semantics into Unsupervised Domain Translation	https://openreview.net/forum?id=IMPA6MndSXU	Samuel Lavoie-Marchildon, Faruk Ahmed, Aaron Courville	Unsupervised Domain Translation, Unsupervised Learning, Image-to-Image Translation, Deep Learning, Representation Learning
247	The Unreasonable Effectiveness of Patches in Deep Convolutional Kernels Methods	https://openreview.net/forum?id=aYuZO9DIdnn	Louis THIRY, Michael Arbel, Eugene Belilovsky, Edouard Oyallon	convolutional kernel methods, image classification
248	Open Question Answering over Tables and Text	https://openreview.net/forum?id=MmCRswl1UYl	Wenhu Chen, Ming-Wei Chang, Eva Schlinger, William Yang Wang, William W. Cohen	Question Answering, Tabular Data, Open-domain, Retrieval
249	Evaluation of Similarity-based Explanations	https://openreview.net/forum?id=9uvhpyQwzM_	Kazuaki Hanawa, Sho Yokoi, Satoshi Hara, Kentaro Inui	Interpretability, Explainability
250	A Diffusion Theory For Deep Learning Dynamics: Stochastic Gradient Descent Exponentially Favors Flat Minima	https://openreview.net/forum?id=wXgk_iCiYGo	Zeke Xie, Issei Sato, Masashi Sugiyama	deep learning dynamics, SGD, diffusion, flat minima, stochastic optimization
251	How Much Over-parameterization Is Sufficient to Learn Deep ReLU Networks?	https://openreview.net/forum?id=fgd7we_uZa6	Zixiang Chen, Yuan Cao, Difan Zou, Quanquan Gu	deep ReLU networks, neural tangent kernel, (stochastic) gradient descent, generalization error, classification
252	Auction Learning as a Two-Player Game	https://openreview.net/forum?id=YHdeAO61l6T	Jad Rahme, Samy Jelassi, S. Matthew Weinberg	Mechanism Design, Auction Theory, Game Theory, Deep Learning
253	Robust Reinforcement Learning on State Observations with Learned Optimal Adversary	https://openreview.net/forum?id=sCZbhBvqQaU	Huan Zhang, Hongge Chen, Duane S Boning, Cho-Jui Hsieh	reinforcement learning, robustness, adversarial attacks, adversarial defense
254	Optimizing Memory Placement using Evolutionary Graph Reinforcement Learning	https://openreview.net/forum?id=-6vS_4Kfz0	Shauharda Khadka, Estelle Aflalo, Mattias Mardar, Avrech Ben-David, Santiago Miret, Shie Mannor, Tamir Hazan, Hanlin Tang, Somdeb Majumdar	Reinforcement Learning, Memory Mapping, Device Placement, Evolutionary Algorithms
255	Hierarchical Autoregressive Modeling for Neural Video Compression	https://openreview.net/forum?id=TK_6nNb_C7q	Ruihan Yang, Yibo Yang, Joseph Marino, Stephan Mandt	Compression, Video Compression, Generative Models, Autoregressive Models
256	Individually Fair Rankings	https://openreview.net/forum?id=71zCSP_HuBN	Amanda Bower, Hamid Eftekhari, Mikhail Yurochkin, Yuekai Sun	algorithmic fairness, learning to rank, optimal transport
257	Learning Neural Generative Dynamics for Molecular Conformation Generation	https://openreview.net/forum?id=pAbm1qfheGk	Minkai Xu, Shitong Luo, Yoshua Bengio, Jian Peng, Jian Tang	Molecular conformation generation, deep generative models, continuous normalizing flow, energy-based models
258	Efficient Certified Defenses Against Patch Attacks on Image Classifiers	https://openreview.net/forum?id=hr-3PMvDpil	Jan Hendrik Metzen, Maksym Yatsura	robustness, certified defense, adversarial patch, aversarial examples
259	Convex Regularization behind Neural Reconstruction	https://openreview.net/forum?id=VErQxgyrbfn	Arda Sahiner, Morteza Mardani, Batu Ozturkler, Mert Pilanci, John M. Pauly	neural networks, image reconstruction, denoising, interpretability, robustness, neural reconstruction, convex duality, inverse problems, sparsity, convex optimization
260	Targeted Attack against Deep Neural Networks via Flipping Limited Weight Bits	https://openreview.net/forum?id=iKQAk8a2kM0	Jiawang Bai, Baoyuan Wu, Yong Zhang, Yiming Li, Zhifeng Li, Shu-Tao Xia	targeted attack, bit-flip, weight attack
261	Generalized Multimodal ELBO	https://openreview.net/forum?id=5Y21V0RDBV	Thomas M. Sutter, Imant Daunhawer, Julia E Vogt	Multimodal, VAE, ELBO, self-supervised, generative learning
262	Large-width functional asymptotics for deep Gaussian neural networks	https://openreview.net/forum?id=0aW6lYOYB7d	Daniele Bracale, Stefano Favaro, Sandra Fortini, Stefano Peluchetti	deep learning theory, infinitely wide neural network, Gaussian process, stochastic process
263	Distributed Momentum for Byzantine-resilient Stochastic Gradient Descent	https://openreview.net/forum?id=H8UHdhWG6A3	El Mahdi El Mhamdi, Rachid Guerraoui, Sébastien Rouault	Byzantine SGD, Distributed ML, Momentum
264	Fully Unsupervised Diversity Denoising with Convolutional Variational Autoencoders	https://openreview.net/forum?id=agHLCOBM5jP	Mangal Prakash, Alexander Krull, Florian Jug	Diversity denoising, Unsupervised denoising, Variational Autoencoders, Noise model
265	Auxiliary Learning by Implicit Differentiation	https://openreview.net/forum?id=n7wIfYPdVet	Aviv Navon, Idan Achituve, Haggai Maron, Gal Chechik, Ethan Fetaya	Auxiliary Learning, Multi-task Learning
266	Balancing Constraints and Rewards with Meta-Gradient D4PG	https://openreview.net/forum?id=TQt98Ya7UMP	Dan A. Calian, Daniel J Mankowitz, Tom Zahavy, Zhongwen Xu, Junhyuk Oh, Nir Levine, Timothy Mann	reinforcement learning, meta-gradients, constraints
267	Adversarially Guided Actor-Critic	https://openreview.net/forum?id=_mQp5cr_iNy	Yannis Flet-Berliac, Johan Ferret, Olivier Pietquin, Philippe Preux, Matthieu Geist	
268	DARTS-: Robustly Stepping out of Performance Collapse Without Indicators	https://openreview.net/forum?id=KLH36ELmwIB	Xiangxiang Chu, Xiaoxing Wang, Bo Zhang, Shun Lu, Xiaolin Wei, Junchi Yan	neural architecture search, DARTS stability
269	Are wider nets better given the same number of parameters?	https://openreview.net/forum?id=_zx8Oka09eF	Anna Golubeva, Guy Gur-Ari, Behnam Neyshabur	network width, over-parametrization, understanding deep learning
270	Optimal Conversion of Conventional Artificial Neural Networks to Spiking Neural Networks	https://openreview.net/forum?id=FZ1oTwcXchK	Shikuang Deng, Shi Gu	spiking neural network, weight balance, second-order approximation
271	Deep Equals Shallow for ReLU Networks in Kernel Regimes	https://openreview.net/forum?id=aDjoksTpXOP	Alberto Bietti, Francis Bach	deep learning, kernels, approximation, neural tangent kernels
272	Graph Coarsening with Neural Networks	https://openreview.net/forum?id=uxpzitPEooJ	Chen Cai, Dingkang Wang, Yusu Wang	graph coarsening, graph neural network, Doubly-weighted Laplace operator
273	Early Stopping in Deep Networks: Double Descent and How to Eliminate it	https://openreview.net/forum?id=tlV90jvZbw	Reinhard Heckel, Fatih Furkan Yilmaz	early stopping, double descent
274	Efficient Inference of Flexible Interaction in Spiking-neuron Networks	https://openreview.net/forum?id=aGfU_xziEX8	Feng Zhou, Yixuan Zhang, Jun Zhu	neural spike train, nonlinear Hawkes process, auxiliary latent variable, conjugacy
275	DICE: Diversity in Deep Ensembles via Conditional Redundancy Adversarial Estimation	https://openreview.net/forum?id=R2ZlTVPx0Gk	Alexandre Rame, Matthieu Cord	Deep Learning, Deep Ensembles, Information Theory, Information Bottleneck, Adversarial Learning
276	Inductive Representation Learning in Temporal Networks via Causal Anonymous Walks	https://openreview.net/forum?id=KYPz4YsCPj	Yanbang Wang, Yen-Yu Chang, Yunyu Liu, Jure Leskovec, Pan Li	temporal networks, inductive representation learning, anonymous walk, network motif
277	FairBatch: Batch Selection for Model Fairness	https://openreview.net/forum?id=YNnpaAKeCfx	Yuji Roh, Kangwook Lee, Steven Euijong Whang, Changho Suh	model fairness, bilevel optimization, batch selection
278	Representation Balancing Offline Model-based Reinforcement Learning	https://openreview.net/forum?id=QpNz8r_Ri2Y	Byung-Jun Lee, Jongmin Lee, Kee-Eung Kim	Reinforcement Learning, Model-based Reinforcement Learning, Offline Reinforcement Learning, Batch Reinforcement Learning, Off-policy policy evaluation
279	Accelerating Convergence of Replica Exchange Stochastic Gradient MCMC via Variance Reduction	https://openreview.net/forum?id=iOnhIy-a-0n	Wei Deng, Qi Feng, Georgios P. Karagiannis, Guang Lin, Faming Liang	variance reduction, replica exchange, parallel tempering, stochastic gradient Langevin dynamics, uncertainty quantification, change of measure, generalized Girsanov theorem, Dirichlet form, Markov jump process
280	The Importance of Pessimism in Fixed-Dataset Policy Optimization	https://openreview.net/forum?id=E3Ys6a1NTGT	Jacob Buckman, Carles Gelada, Marc G Bellemare	deep learning, reinforcement learning, offline reinforcement learning
281	Interpreting Knowledge Graph Relation Representation from Word Embeddings	https://openreview.net/forum?id=gLWj29369lW	Carl Allen, Ivana Balazevic, Timothy Hospedales	knowledge graphs, word embedding, representation learning
282	Hopfield Networks is All You Need	https://openreview.net/forum?id=tL89RnzIiCd	Hubert Ramsauer, Bernhard Schäfl, Johannes Lehner, Philipp Seidl, Michael Widrich, Lukas Gruber, Markus Holzleitner, Thomas Adler, David Kreil, Michael K Kopp, Günter Klambauer, Johannes Brandstetter, Sepp Hochreiter	Modern Hopfield Network, Energy, Attention, Convergence, Storage Capacity, Hopfield layer, Associative Memory
283	Uncertainty Estimation and Calibration with Finite-State Probabilistic RNNs	https://openreview.net/forum?id=9EKHN1jOlA	Cheng Wang, Carolin Lawrence, Mathias Niepert	uncertainty estimation, calibration, RNN
284	Understanding the failure modes of out-of-distribution generalization	https://openreview.net/forum?id=fSTD6NFIW_b	Vaishnavh Nagarajan, Anders Andreassen, Behnam Neyshabur	out-of-distribution generalization, spurious correlations, empirical risk minimization, theoretical study
285	Generative Language-Grounded Policy in Vision-and-Language Navigation with Bayes' Rule	https://openreview.net/forum?id=45uOPa46Kh	Shuhei Kurita, Kyunghyun Cho	vision-and-language-navigation
286	Emergent Road Rules In Multi-Agent Driving Environments	https://openreview.net/forum?id=d8Q1mt2Ghw	Avik Pal, Jonah Philion, Yuan-Hong Liao, Sanja Fidler	
287	Wasserstein-2 Generative Networks	https://openreview.net/forum?id=bEoxzW_EXsa	Alexander Korotin, Vage Egiazarian, Arip Asadulaev, Alexander Safin, Evgeny Burnaev	wasserstein-2 distance, optimal transport maps, non-minimax optimization, cycle-consistency regularization, input-convex neural networks
288	Vulnerability-Aware Poisoning Mechanism for Online RL with Unknown Dynamics	https://openreview.net/forum?id=9r30XCjf5Dt	Yanchao Sun, Da Huo, Furong Huang	poisoning attack, policy gradient, vulnerability of RL, deep RL
289	Tomographic Auto-Encoder: Unsupervised Bayesian Recovery of Corrupted Data	https://openreview.net/forum?id=YtMG5ex0ou	Francesco Tonolini, Pablo Garcia Moreno, Andreas Damianou, Roderick Murray-Smith	Missing value imputation, variational inference, variational auto-encoders
290	Monotonic Kronecker-Factored Lattice	https://openreview.net/forum?id=0pxiMpCyBtr	William Taylor Bakst, Nobuyuki Morioka, Erez Louidor	Theory, Regularization, Algorithms, Classification, Regression, Matrix and Tensor Factorization, Fairness, Evaluation, Efficiency, Machine Learning
291	LEAF: A Learnable Frontend for Audio Classification	https://openreview.net/forum?id=jM76BCb6F9m	Neil Zeghidour, Olivier Teboul, Félix de Chaumont Quitry, Marco Tagliasacchi	audio understanding, frontend, learnable, mel-filterbanks, time-frequency representations, sound classification
292	Federated Learning via Posterior Averaging: A New Perspective and Practical Algorithms	https://openreview.net/forum?id=GFsU8a0sGB	Maruan Al-Shedivat, Jennifer Gillenwater, Eric Xing, Afshin Rostamizadeh	federated learning, posterior inference, MCMC
293	Rank the Episodes: A Simple Approach for Exploration in Procedurally-Generated Environments	https://openreview.net/forum?id=MtEE0CktZht	Daochen Zha, Wenye Ma, Lei Yuan, Xia Hu, Ji Liu	Reinforcement Learning, Exploration, Generalization of Reinforcement Learning, Self-Imitation
294	Partitioned Learned Bloom Filters	https://openreview.net/forum?id=6BRLOfrMhW	Kapil Vaidya, Eric Knorr, Michael Mitzenmacher, Tim Kraska	optimization, data structures, algorithms, theory, learned algorithms
295	Approximate Nearest Neighbor Negative Contrastive Learning for Dense Text Retrieval	https://openreview.net/forum?id=zeFrfgyZln	Lee Xiong, Chenyan Xiong, Ye Li, Kwok-Fung Tang, Jialin Liu, Paul N. Bennett, Junaid Ahmed, Arnold Overwijk	Dense Retrieval, Text Retrieval, Text Representation, Neural IR
296	AUXILIARY TASK UPDATE DECOMPOSITION: THE GOOD, THE BAD AND THE NEUTRAL	https://openreview.net/forum?id=1GTma8HwlYp	Lucio M. Dery, Yann Dauphin, David Grangier	pre-training, multitask learning, deeplearning, gradient decomposition
297	SSD: A Unified Framework for Self-Supervised Outlier Detection	https://openreview.net/forum?id=v5gjXpmR8J	Vikash Sehwag, Mung Chiang, Prateek Mittal	Outlier detection, Out-of-distribution detection in deep learning, Anomaly detection with deep neural networks, Self-supervised learning
298	Ask Your Humans: Using Human Instructions to Improve Generalization in Reinforcement Learning	https://openreview.net/forum?id=Y87Ri-GNHYu	Valerie Chen, Abhinav Gupta, Kenneth Marino	
299	Revisiting Few-sample BERT Fine-tuning	https://openreview.net/forum?id=cO1IH43yUF	Tianyi Zhang, Felix Wu, Arzoo Katiyar, Kilian Q Weinberger, Yoav Artzi	Fine-tuning, Optimization, BERT
300	Tilted Empirical Risk Minimization	https://openreview.net/forum?id=K5YasWXZT3O	Tian Li, Ahmad Beirami, Maziar Sanjabi, Virginia Smith	exponential tilting, models of learning and generalization, label noise robustness, fairness
301	Deep Neural Tangent Kernel and Laplace Kernel Have the Same RKHS	https://openreview.net/forum?id=vK9WrZ0QYQ	Lin Chen, Sheng Xu	Neural tangent kernel, Reproducing kernel Hilbert space, Laplace kernel, Singularity analysis
302	On the Transfer of Disentangled Representations in Realistic Settings	https://openreview.net/forum?id=8VXvj1QNRl1	Andrea Dittadi, Frederik Träuble, Francesco Locatello, Manuel Wuthrich, Vaibhav Agrawal, Ole Winther, Stefan Bauer, Bernhard Schölkopf	representation learning, disentanglement, real-world
303	Calibration tests beyond classification	https://openreview.net/forum?id=-bxf89v3Nx	David Widmann, Fredrik Lindsten, Dave Zachariah	calibration, uncertainty quantification, framework, integral probability metric, maximum mean discrepancy
