No.	Title	Link	Authors	Keywords
611	Reinforcement Learning with Random Delays	https://openreview.net/forum?id=QFYnKlBJYR	Yann Bouteiller, Simon Ramstedt, Giovanni Beltrame, Christopher Pal, Jonathan Binas	Reinforcement Learning, Deep Reinforcement Learning
612	Isotropy in the Contextual Embedding Space: Clusters and Manifolds	https://openreview.net/forum?id=xYGNO86OWDH	Xingyu Cai, Jiaji Huang, Yuchen Bian, Kenneth Church	Contextual embedding space, Isotropy, Clusters, Manifolds
613	Spatio-Temporal Graph Scattering Transform	https://openreview.net/forum?id=CF-ZIuSMXRz	Chao Pan, Siheng Chen, Antonio Ortega	scattering transform, spatio-temporal graph, graph neural networks, skeleton-based action recognition
614	Deployment-Efficient Reinforcement Learning via Model-Based Offline Optimization	https://openreview.net/forum?id=3hGNqpI4WS	Tatsuya Matsushima, Hiroki Furuta, Yutaka Matsuo, Ofir Nachum, Shixiang Gu	Reinforcement Learning, deployment-efficiency, offline RL, Model-based RL
615	gradSim: Differentiable simulation for system identification and visuomotor control	https://openreview.net/forum?id=c_E8kFWfhp0	J. Krishna Murthy, Miles Macklin, Florian Golemo, Vikram Voleti, Linda Petrini, Martin Weiss, Breandan Considine, Jérôme Parent-Lévesque, Kevin Xie, Kenny Erleben, Liam Paull, Florian Shkurti, Derek Nowrouzezahrai, Sanja Fidler	Differentiable simulation, System identification, Physical parameter estimation, 3D scene understanding, 3D vision, Differentiable rendering, Differentiable physics
616	Evaluations and Methods for Explanation through Robustness Analysis	https://openreview.net/forum?id=4dXmpCDGNp7	Cheng-Yu Hsieh, Chih-Kuan Yeh, Xuanqing Liu, Pradeep Kumar Ravikumar, Seungyeon Kim, Sanjiv Kumar, Cho-Jui Hsieh	Interpretability, Explanations, Adversarial Robustness
617	RNNLogic: Learning Logic Rules for Reasoning on Knowledge Graphs	https://openreview.net/forum?id=tGZu6DlbreV	Meng Qu, Junkun Chen, Louis-Pascal Xhonneux, Yoshua Bengio, Jian Tang	Knowledge Graph Reasoning, Logic Rules, EM
618	Can a Fruit Fly Learn Word Embeddings?	https://openreview.net/forum?id=xfmSoxdxFCG	Yuchen Liang, Chaitanya Ryali, Benjamin Hoover, Leopold Grinberg, Saket Navlakha, Mohammed J Zaki, Dmitry Krotov	neurobiology, neuroscience, fruit fly, locality sensitive hashing, word embedding, sparse representations
619	Neural representation and generation for RNA secondary structures	https://openreview.net/forum?id=snOgiCYZgJ7	Zichao Yan, William L. Hamilton, Mathieu Blanchette	Graph neural network, Deep generative modeling, Machine learning, Drug discovery, RNA structure, RNA structure embedding, RNA-protein interaction prediction
620	WaNet - Imperceptible Warping-based Backdoor Attack	https://openreview.net/forum?id=eEn8KTtJOx	Tuan Anh Nguyen, Anh Tuan Tran	backdoor attack, image warping, wanet
621	LowKey: Leveraging Adversarial Attacks to Protect Social Media Users from Facial Recognition	https://openreview.net/forum?id=hJmtwocEqzc	Valeriia Cherepanova, Micah Goldblum, Harrison Foley, Shiyuan Duan, John P Dickerson, Gavin Taylor, Tom Goldstein	facial recognition, adversarial attacks
622	Learning from others' mistakes: Avoiding dataset biases without modeling them	https://openreview.net/forum?id=Hf3qXoiNkR	Victor Sanh, Thomas Wolf, Yonatan Belinkov, Alexander M Rush	dataset bias, product of experts, natural language processing
623	Prototypical Contrastive Learning of Unsupervised Representations	https://openreview.net/forum?id=KmykpuSrjcq	Junnan Li, Pan Zhou, Caiming Xiong, Steven Hoi	self-supervised learning, unsupervised learning, representation learning, contrastive learning
624	Extreme Memorization via Scale of Initialization	https://openreview.net/forum?id=Z4R1vxLbRLO	Harsh Mehta, Ashok Cutkosky, Behnam Neyshabur	Scale of initialization, Memorization, Overfitting, Generalization, Generalization Measure, Understanding Deep Learning
625	Interactive Weak Supervision: Learning Useful Heuristics for Data Labeling	https://openreview.net/forum?id=IDFQI9OY6K	Benedikt Boecking, Willie Neiswanger, Eric Xing, Artur Dubrawski	weak supervision, data programming, data labeling, active learning
626	Adaptive Procedural Task Generation for Hard-Exploration Problems	https://openreview.net/forum?id=8xLkv08d70T	Kuan Fang, Yuke Zhu, Silvio Savarese, Fei-Fei Li	reinforcement learning, curriculum learning, procedural generation, task generation
627	Multi-timescale Representation Learning in LSTM Language Models	https://openreview.net/forum?id=9ITXiTrAoT	Shivangi Mahto, Vy Ai Vo, Javier S. Turek, Alexander Huth	Language Model, LSTM, timescales
628	Deep Encoder, Shallow Decoder: Reevaluating Non-autoregressive Machine Translation	https://openreview.net/forum?id=KpfasTaLUpq	Jungo Kasai, Nikolaos Pappas, Hao Peng, James Cross, Noah Smith	Machine Translation, Sequence Modeling, Natural Language Processing
629	Learning Better Structured Representations Using Low-rank Adaptive Label Smoothing	https://openreview.net/forum?id=5NsEIflpbSv	Asish Ghoshal, Xilun Chen, Sonal Gupta, Luke Zettlemoyer, Yashar Mehdad	label smoothing, calibration, semantic parsing, structured prediction
630	Predicting Inductive Biases of Pre-Trained Models	https://openreview.net/forum?id=mNtmhaDkAr	Charles Lovering, Rohan Jha, Tal Linzen, Ellie Pavlick	information-theoretical probing, probing, challenge sets, natural language processing
631	Molecule Optimization by Explainable Evolution	https://openreview.net/forum?id=jHefDGsorp5	Binghong Chen, Tianzhe Wang, Chengtao Li, Hanjun Dai, Le Song	Molecule Design, Explainable Model, Evolutionary Algorithm, Reinforcement Learning, Graph Generative Model
632	Anchor & Transform: Learning Sparse Embeddings for Large Vocabularies	https://openreview.net/forum?id=Vd7lCMvtLqg	Paul Pu Liang, Manzil Zaheer, Yuan Wang, Amr Ahmed	sparse embeddings, large vocabularies, text classification, language modeling, recommendation systems
633	PSTNet: Point Spatio-Temporal Convolution on Point Cloud Sequences	https://openreview.net/forum?id=O3bqkf_Puys	Hehe Fan, Xin Yu, Yuhang Ding, Yi Yang, Mohan Kankanhalli	Point cloud, spatio-temporal modeling, video analysis, action recognition, semantic segmentation, convolutional neural network
634	Group Equivariant Conditional Neural Processes	https://openreview.net/forum?id=e8W-hsu_q5	Makoto Kawano, Wataru Kumagai, Akiyoshi Sannai, Yusuke Iwasawa, Yutaka Matsuo	Neural Processes, Conditional Neural Processes, Stochastic Processes, Regression, Group Equivariance, Symmetry
635	When does preconditioning help or hurt generalization?	https://openreview.net/forum?id=S724o4_WB3	Shun-ichi Amari, Jimmy Ba, Roger Baker Grosse, Xuechen Li, Atsushi Nitanda, Taiji Suzuki, Denny Wu, Ji Xu	generalization, second-order optimization, natural gradient descent, high-dimensional asymptotics
636	Learning Reasoning Paths over Semantic Graphs for Video-grounded Dialogues	https://openreview.net/forum?id=hPWj1qduVw8	Hung Le, Nancy F. Chen, Steven Hoi	video-grounded dialogues, reasoning paths, semantic graphs
637	Prototypical Representation Learning for Relation Extraction	https://openreview.net/forum?id=aCgLmfhIy_f	Ning Ding, Xiaobin Wang, Yao Fu, Guangwei Xu, Rui Wang, Pengjun Xie, Ying Shen, Fei Huang, Hai-Tao Zheng, Rui Zhang	NLP, Relation Extraction, Representation Learning
638	Layer-adaptive Sparsity for the Magnitude-based Pruning	https://openreview.net/forum?id=H6ATjJ0TKdf	Jaeho Lee, Sejun Park, Sangwoo Mo, Sungsoo Ahn, Jinwoo Shin	network pruning, layerwise sparsity, magnitude-based pruning
639	Refining Deep Generative Models via Discriminator Gradient Flow	https://openreview.net/forum?id=Zbc-ue9p_rE	Abdul Fatir Ansari, Ming Liang Ang, Harold Soh	gradient flows, generative models, GAN, VAE, Normalizing Flow
640	Explaining the Efficacy of Counterfactually Augmented Data	https://openreview.net/forum?id=HHiiQKWsOcV	Divyansh Kaushik, Amrith Setlur, Eduard H Hovy, Zachary Chase Lipton	humans in the loop, annotation artifacts, text classification, sentiment analysis, natural language inference
641	Lipschitz Recurrent Neural Networks	https://openreview.net/forum?id=-N7PBXqOUJZ	N. Benjamin Erichson, Omri Azencot, Alejandro Queiruga, Liam Hodgkinson, Michael W. Mahoney	recurrent neural networks, dynamical systems, differential equations
642	Learning Hyperbolic Representations of Topological Features	https://openreview.net/forum?id=yqPnIRhHtZv	Panagiotis Kyriakis, Iordanis Fostiropoulos, Paul Bogdan	representation learning, hyperbolic deep learning, persistent homology, persistence diagrams
643	Bidirectional Variational Inference for Non-Autoregressive Text-to-Speech	https://openreview.net/forum?id=o3iritJHLfO	Yoonhyung Lee, Joongbo Shin, Kyomin Jung	text-to-speech, speech synthesis, non-autoregressive, VAE
644	Risk-Averse Offline Reinforcement Learning	https://openreview.net/forum?id=TBIzh9b5eaz	Núria Armengol Urpí, Sebastian Curi, Andreas Krause	offline, reinforcement learning, risk-averse, risk sensitive, robust, safety, safe
645	Group Equivariant Stand-Alone Self-Attention For Vision	https://openreview.net/forum?id=JkfYjnOEo6M	David W. Romero, Jean-Baptiste Cordonnier	group equivariant transformers, group equivariant self-attention, group equivariance, self-attention, transformers
646	A Better Alternative to Error Feedback for Communication-Efficient Distributed Learning	https://openreview.net/forum?id=vYVI1CHPaQg	Samuel Horváth, Peter Richtarik	distributed optimization, communication efficiency
647	Neural Delay Differential Equations	https://openreview.net/forum?id=Q1jmmQz72M2	Qunxi Zhu, Yao Guo, Wei Lin	Delay differential equations, neural networks
648	Capturing Label Characteristics in VAEs	https://openreview.net/forum?id=wQRlSUZ5V7B	Tom Joy, Sebastian Schmon, Philip Torr, Siddharth N, Tom Rainforth	variational autoencoder, representation learning, deep generative models
649	Graph Edit Networks	https://openreview.net/forum?id=dlEJsyHGeaL	Benjamin Paassen, Daniele Grattarola, Daniele Zambon, Cesare Alippi, Barbara Eva Hammer	graph neural networks, graph edit distance, time series prediction, structured prediction
650	InfoBERT: Improving Robustness of Language Models from An Information Theoretic Perspective	https://openreview.net/forum?id=hpH98mK5Puk	Boxin Wang, Shuohang Wang, Yu Cheng, Zhe Gan, Ruoxi Jia, Bo Li, Jingjing Liu	adversarial robustness, information theory, BERT, adversarial training, NLI, QA
651	DrNAS: Dirichlet Neural Architecture Search	https://openreview.net/forum?id=9FWas6YbmB3	Xiangning Chen, Ruochen Wang, Minhao Cheng, Xiaocheng Tang, Cho-Jui Hsieh	
652	Drop-Bottleneck: Learning Discrete Compressed Representation for Noise-Robust Exploration	https://openreview.net/forum?id=1rxHOBjeDUW	Jaekyeom Kim, Minjung Kim, Dongyeon Woo, Gunhee Kim	Reinforcement learning, Information bottleneck
653	Monte-Carlo Planning and Learning with Language Action Value Estimates	https://openreview.net/forum?id=7_G8JySGecm	Youngsoo Jang, Seokin Seo, Jongmin Lee, Kee-Eung Kim	natural language processing, Monte-Carlo tree search, reinforcement learning, interactive fiction
654	Robust early-learning: Hindering the memorization of noisy labels	https://openreview.net/forum?id=Eql5b1_hTE4	Xiaobo Xia, Tongliang Liu, Bo Han, Chen Gong, Nannan Wang, Zongyuan Ge, Yi Chang	
655	Identifying Physical Law of Hamiltonian Systems via Meta-Learning	https://openreview.net/forum?id=45NZvF1UHam	Seungjun Lee, Haesang Yang, Woojae Seong	Learning physical laws, meta-learning, Hamiltonian systems
656	Reweighting Augmented Samples by Minimizing the Maximal Expected Loss	https://openreview.net/forum?id=9G5MIc-goqB	Mingyang Yi, Lu Hou, Lifeng Shang, Xin Jiang, Qun Liu, Zhi-Ming Ma	data augmentation, sample reweighting
657	Understanding and Improving Encoder Layer Fusion in Sequence-to-Sequence Learning	https://openreview.net/forum?id=n1HD8M6WGn	Xuebo Liu, Longyue Wang, Derek F. Wong, Liang Ding, Lidia S. Chao, Zhaopeng Tu	Encoder layer fusion, Transformer, Sequence-to-sequence learning, Machine translation, Summarization, Grammatical error correction
658	Spatial Dependency Networks: Neural Layers for Improved Generative Image Modeling	https://openreview.net/forum?id=I4c4K9vBNny	Đorđe Miladinović, Aleksandar Stanić, Stefan Bauer, Jürgen Schmidhuber, Joachim M. Buhmann	Neural networks, Deep generative models, Image Modeling, Variational Autoencoders
659	Deep Repulsive Clustering of Ordered Data Based on Order-Identity Decomposition	https://openreview.net/forum?id=Yz-XtK5RBxB	Seon-Ho Lee, Chang-Su Kim	Clustering, order learning, age estimation, aesthetic assessment, historical color image classification
660	Revisiting Locally Supervised Learning: an Alternative to End-to-end Training	https://openreview.net/forum?id=fAbkE6ant2	Yulin Wang, Zanlin Ni, Shiji Song, Le Yang, Gao Huang	Locally supervised training, Deep learning
661	Nonseparable Symplectic Neural Networks	https://openreview.net/forum?id=B5VvQrI49Pa	Shiying Xiong, Yunjin Tong, Xingzhe He, Shuqi Yang, Cheng Yang, Bo Zhu	Data-driven modeling, nonseparable Hailtonian system, symplectic networks
662	Gradient Origin Networks	https://openreview.net/forum?id=0O_cQfw6uEh	Sam Bond-Taylor, Chris G. Willcocks	Deep Learning, Generative Models, Implicit Representation
663	Learning to Sample with Local and Global Contexts in Experience Replay Buffer	https://openreview.net/forum?id=gJYlaqL8i8	Youngmin Oh, Kimin Lee, Jinwoo Shin, Eunho Yang, Sung Ju Hwang	reinforcement learning, experience replay buffer, off-policy RL
664	Provable Rich Observation Reinforcement Learning with Combinatorial Latent States	https://openreview.net/forum?id=hx1IXFHAw7R	Dipendra Misra, Qinghua Liu, Chi Jin, John Langford	Reinforcement learning theory, Rich observation, Noise-contrastive learning, State abstraction, Factored MDP
665	Sharper Generalization Bounds for Learning with Gradient-dominated Objective Functions	https://openreview.net/forum?id=r28GdiQF7vM	Yunwen Lei, Yiming Ying	generalization bounds, non-convex learning
666	Rapid Neural Architecture Search by Learning to Generate Graphs from Datasets	https://openreview.net/forum?id=rkQuFUmUOg3	Hayeon Lee, Eunyoung Hyung, Sung Ju Hwang	Machine Learning, Neural Architecture Search, Meta-learning
667	Relating by Contrasting: A Data-efficient Framework for Multimodal Generative Models	https://openreview.net/forum?id=vhKe9UFbrJo	Yuge Shi, Brooks Paige, Philip Torr, Siddharth N	Deep generative model, multi-modal learning, representation learning
668	FedMix: Approximation of Mixup under Mean Augmented Federated Learning	https://openreview.net/forum?id=Ogga20D2HO-	Tehrim Yoon, Sumin Shin, Sung Ju Hwang, Eunho Yang	federated learning, mixup
669	Generalized Variational Continual Learning	https://openreview.net/forum?id=_IM-AfFhna9	Noel Loo, Siddharth Swaroop, Richard E Turner	
670	Understanding and Improving Lexical Choice in Non-Autoregressive Translation	https://openreview.net/forum?id=ZTFeSBIX9C	Liang Ding, Longyue Wang, Xuebo Liu, Derek F. Wong, Dacheng Tao, Zhaopeng Tu	
671	Bayesian Context Aggregation for Neural Processes	https://openreview.net/forum?id=ufZN2-aehFa	Michael Volpp, Fabian Flürenbrock, Lukas Grossberger, Christian Daniel, Gerhard Neumann	Aggregation Methods, Neural Processes, Latent Variable Models, Meta Learning, Multi-task Learning, Deep Sets
672	Variational Intrinsic Control Revisited	https://openreview.net/forum?id=P0p33rgyoE	Taehwan Kwon	Unsupervised reinforcement learning, Information theory
673	Implicit Gradient Regularization	https://openreview.net/forum?id=3q5IqUrkcF	David Barrett, Benoit Dherin	implicit regularization, deep learning, deep learning theory, theoretical issues in deep learning, theory, regularization
674	Return-Based Contrastive Representation Learning for Reinforcement Learning	https://openreview.net/forum?id=_TM6rT7tXke	Guoqing Liu, Chuheng Zhang, Li Zhao, Tao Qin, Jinhua Zhu, Li Jian, Nenghai Yu, Tie-Yan Liu	reinforcement learning, auxiliary task, representation learning, contrastive learning
675	Scalable Bayesian Inverse Reinforcement Learning	https://openreview.net/forum?id=4qR3coiNaIv	Alex James Chan, Mihaela van der Schaar	Bayesian, Inverse reinforcement learning, Imitation Learning
676	Exemplary Natural Images Explain CNN Activations Better than State-of-the-Art Feature Visualization	https://openreview.net/forum?id=QO9-y8also-	Judy Borowski, Roland Simon Zimmermann, Judith Schepers, Robert Geirhos, Thomas S. A. Wallis, Matthias Bethge, Wieland Brendel	evaluation of interpretability, feature visualization, activation maximization, human psychophysics, understanding CNNs, explanation method
677	LiftPool: Bidirectional ConvNet Pooling	https://openreview.net/forum?id=kE3vd639uRW	Jiaojiao Zhao, Cees G. M. Snoek	bidirectional, pooling
678	Adversarial score matching and improved sampling for image generation	https://openreview.net/forum?id=eLfqMl3z3lq	Alexia Jolicoeur-Martineau, Rémi Piché-Taillefer, Ioannis Mitliagkas, Remi Tachet des Combes	adversarial, score matching, Langevin dynamics, GAN, generative model
679	Transient Non-stationarity and Generalisation in Deep Reinforcement Learning	https://openreview.net/forum?id=Qun8fv4qSby	Maximilian Igl, Gregory Farquhar, Jelena Luketina, Wendelin Boehmer, Shimon Whiteson	Reinforcement Learning, Generalization
680	On the Origin of Implicit Regularization in Stochastic Gradient Descent	https://openreview.net/forum?id=rq_Qr0c1Hyo	Samuel L Smith, Benoit Dherin, David Barrett, Soham De	SGD, learning rate, batch size, optimization, generalization, implicit regularization, backward error analysis, SDE, stochastic differential equation, ODE, ordinary differential equation
681	Analyzing the Expressive Power of Graph Neural Networks in a Spectral Perspective	https://openreview.net/forum?id=-qh0M9XWxnv	Muhammet Balcilar, Guillaume Renton, Pierre Héroux, Benoit Gaüzère, Sébastien Adam, Paul Honeine	Graph Neural Networks, Spectral Graph Filter, Spectral Analysis
682	Pruning Neural Networks at Initialization: Why Are We Missing the Mark?	https://openreview.net/forum?id=Ig-VyQc-MLK	Jonathan Frankle, Gintare Karolina Dziugaite, Daniel Roy, Michael Carbin	Pruning, Sparsity, Lottery Ticket, Science
683	SkipW: Resource Adaptable RNN with Strict Upper Computational Limit	https://openreview.net/forum?id=2CjEVW-RGOJ	Tsiry Mayet, Anne Lambert, Pascal Leguyadec, Francoise Le Bolzer, François Schnitzler	Recurrent neural networks, Flexibility, Computational resources
684	Into the Wild with AudioScope: Unsupervised Audio-Visual Separation of On-Screen Sounds	https://openreview.net/forum?id=MDsQkFP1Aw	Efthymios Tzinis, Scott Wisdom, Aren Jansen, Shawn Hershey, Tal Remez, Dan Ellis, John R. Hershey	Audio-visual sound separation, in-the-wild data, unsupervised learning, self-supervised learning, universal sound separation
685	Simple Augmentation Goes a Long Way: ADRL for DNN Quantization	https://openreview.net/forum?id=Qr0aRliE_Hb	Lin Ning, Guoyang Chen, Weifeng Zhang, Xipeng Shen	Reinforcement Learning, Quantization, mixed precision, augmented deep reinforcement learning, DNN
686	Few-Shot Bayesian Optimization with Deep Kernel Surrogates	https://openreview.net/forum?id=bJxgv5C3sYc	Martin Wistuba, Josif Grabocka	bayesian optimization, metalearning, few-shot learning, automl
687	AdaSpeech: Adaptive Text to Speech for Custom Voice	https://openreview.net/forum?id=Drynvt7gg4L	Mingjian Chen, Xu Tan, Bohan Li, Yanqing Liu, Tao Qin, sheng zhao, Tie-Yan Liu	Text to speech, adaptation, fine-tuning, custom voice, acoustic condition modeling, conditional layer normalization
688	HeteroFL: Computation and Communication Efficient Federated Learning for Heterogeneous Clients	https://openreview.net/forum?id=TNkPBBYFkXg	Enmao Diao, Jie Ding, Vahid Tarokh	Federated Learning, Internet of Things, Heterogeneity
689	DINO: A Conditional Energy-Based GAN for Domain Translation	https://openreview.net/forum?id=WAISmwsqDsb	Konstantinos Vougioukas, Stavros Petridis, Maja Pantic	Generative Modelling, Domain Translation, Conditional GANs, Energy-Based GANs
690	Universal Weakly Supervised Segmentation by Pixel-to-Segment Contrastive Learning	https://openreview.net/forum?id=N33d7wjgzde	Tsung-Wei Ke, Jyh-Jing Hwang, Stella Yu	weakly supervised representation learning, representation learning for computer vision, metric learning, semantic segmentation
691	PC2WF: 3D Wireframe Reconstruction from Raw Point Clouds	https://openreview.net/forum?id=8X2eaSZxTP	Yujia Liu, Stefano D'Aronco, Konrad Schindler, Jan Dirk Wegner	deep neural network, 3d point cloud, wireframe model
692	Multi-resolution modeling of a discrete stochastic process identifies causes of cancer	https://openreview.net/forum?id=KtH8W3S_RE	Adam Uri Yaari, Maxwell Sherman, Oliver Clarke Priebe, Po-Ru Loh, Boris Katz, Andrei Barbu, Bonnie Berger	Computational Biology, non-stationary stochastic processes, cancer research, deep learning, probabelistic models, graphical models
693	C-Learning: Horizon-Aware Cumulative Accessibility Estimation	https://openreview.net/forum?id=W3Wf_wKmqm9	Panteha Naderian, Gabriel Loaiza-Ganem, Harry J. Braviner, Anthony L. Caterini, Jesse C. Cresswell, Tong Li, Animesh Garg	reinforcement learning, goal reaching, Q-learning
694	Shapley Explanation Networks	https://openreview.net/forum?id=vsU0efpivw	Rui Wang, Xiaoqian Wang, David I. Inouye	Shapley values, Feature Attribution, Interpretable Machine Learning
695	The role of Disentanglement in Generalisation	https://openreview.net/forum?id=qbH974jKUVy	Milton Llera Montero, Casimir JH Ludwig, Rui Ponte Costa, Gaurav Malhotra, Jeffrey Bowers	disentanglement, compositionality, compositional generalization, generalisation, generative models, variational autoencoders
696	Learning N:M Fine-grained Structured Sparse Neural Networks From Scratch	https://openreview.net/forum?id=K9bw7vqp_s	Aojun Zhou, Yukun Ma, Junnan Zhu, Jianbo Liu, Zhijie Zhang, Kun Yuan, Wenxiu Sun, Hongsheng Li	sparsity, efficient training and inference.
697	Unsupervised Meta-Learning through Latent-Space Interpolation in Generative Models	https://openreview.net/forum?id=XOjv2HxIF6i	Siavash Khodadadeh, Sharare Zehtabian, Saeed Vahidian, Weijia Wang, Bill Lin, Ladislau Boloni	Meta-learning, Unsupervised learning, GANs
698	On Data-Augmentation and Consistency-Based Semi-Supervised Learning	https://openreview.net/forum?id=7FNqrcPtieT	Atin Ghosh, Alexandre H. Thiery	Semi-Supervised Learning, Regularization, Data augmentation
699	Learning from Demonstration with Weakly Supervised Disentanglement	https://openreview.net/forum?id=Ldau9eHU-qO	Yordan Hristov, Subramanian Ramamoorthy	representation learning for robotics, physical symbol grounding, semi-supervised learning
700	Neurally Augmented ALISTA	https://openreview.net/forum?id=q_S44KLQ_Aa	Freya Behrens, Jonathan Sauder, Peter Jung	compressed sensing, sparse reconstruction, unrolled algorithms, learned ISTA
701	Shape or Texture: Understanding Discriminative Features in CNNs	https://openreview.net/forum?id=NcFEZOi-rLa	Md Amirul Islam, Matthew Kowal, Patrick Esser, Sen Jia, Björn Ommer, Konstantinos G. Derpanis, Neil Bruce	Shape, Texture, Shape Bias, Texture Bias, Shape Encoding, Mutual Information
702	Convex Potential Flows: Universal Probability Distributions with Optimal Transport and Convex Optimization	https://openreview.net/forum?id=te7PVH1sPxJ	Chin-Wei Huang, Ricky T. Q. Chen, Christos Tsirigotis, Aaron Courville	Normalizing flows, generative models, variational inference, invertible neural networks, universal approximation, optimal transport, convex optimization
703	Wasserstein Embedding for Graph Learning	https://openreview.net/forum?id=AAes_3W-2z	Soheil Kolouri, Navid Naderializadeh, Gustavo K. Rohde, Heiko Hoffmann	Wasserstein, graph embedding, graph-level prediction
704	Meta-learning with negative learning rates	https://openreview.net/forum?id=60j5LygnmD	Alberto Bernacchia	Meta-learning
705	Representing Partial Programs with Blended Abstract Semantics	https://openreview.net/forum?id=mCtadqIxOJ	Maxwell Nye, Yewen Pu, Matthew Bowers, Jacob Andreas, Joshua B. Tenenbaum, Armando Solar-Lezama	program synthesis, representation learning, abstract interpretation, modular neural networks
706	Fast convergence of stochastic subgradient method under interpolation	https://openreview.net/forum?id=w2mYg3d0eot	Huang Fang, Zhenan Fan, Michael Friedlander	Optimization, stochastic subgradient method, interpolation, convergence analysis
707	A Hypergradient Approach to Robust Regression without Correspondence	https://openreview.net/forum?id=l35SB-_raSQ	Yujia Xie, Yixiu Mao, Simiao Zuo, Hongteng Xu, Xiaojing Ye, Tuo Zhao, Hongyuan Zha	Regression without correspondence, differentiable programming, first-order optimization, Sinkhorn algorithm
708	On the role of planning in model-based deep reinforcement learning	https://openreview.net/forum?id=IrM64DGB21	Jessica B Hamrick, Abram L. Friesen, Feryal Behbahani, Arthur Guez, Fabio Viola, Sims Witherspoon, Thomas Anthony, Lars Holger Buesing, Petar Veličković, Theophane Weber	model-based RL, planning, MuZero
709	Trajectory Prediction using Equivariant Continuous Convolution	https://openreview.net/forum?id=J8_GttYLFgr	Robin Walters, Jinxi Li, Rose Yu	equivariant, symmetry, trajectory prediction, continuous convolution, argoverse
710	Grounding Language to Autonomously-Acquired Skills via Goal Generation	https://openreview.net/forum?id=chPj_I5KMHG	Ahmed Akakzia, Cédric Colas, Pierre-Yves Oudeyer, Mohamed CHETOUANI, Olivier Sigaud	Deep reinforcement learning, intrinsic motivations, symbolic representations, autonomous learning
711	Chaos of Learning Beyond Zero-sum and Coordination via Game Decompositions	https://openreview.net/forum?id=a3wKPZpGtCF	Yun Kuen Cheung, Yixin Tao	Learning in Games, Lyapunov Chaos, Game Decomposition, Multiplicative Weights Update, Follow-the-Regularized-Leader, Volume Analysis, Dynamical Systems
